{
  "$id": "urn:ratatoskr:contracts:commands:v1:ChannelDigestRunRequested",
  "$schema": "https://json-schema.org/draft/2020-12/schema",
  "title": "ChannelDigestRunRequested",
  "description": "Payload of `channel_digest.run.requested.v1`.",
  "type": "object",
  "properties": {
    "digest_run_id": {
      "description": "Stable digest-run identity selected before dispatch.",
      "$ref": "#/$defs/ChannelDigestRunId"
    },
    "idempotency_key": {
      "description": "Stable logical request identity.",
      "$ref": "#/$defs/ChannelDigestIdempotencyKey"
    },
    "operation_id": {
      "description": "Platform operation owning this visible run.",
      "$ref": "#/$defs/OperationId"
    },
    "output_language": {
      "description": "Requested recap output language.",
      "$ref": "#/$defs/OutputLanguage"
    },
    "owner": {
      "description": "Authenticated internal user owner.",
      "$ref": "#/$defs/TenantRef"
    },
    "trigger": {
      "description": "Authority which selected the run and its end instant.",
      "$ref": "#/$defs/ChannelDigestRunTrigger"
    },
    "window": {
      "description": "Bounded closed-open acquisition window.",
      "$ref": "#/$defs/DigestWindow"
    }
  },
  "additionalProperties": true,
  "required": [
    "digest_run_id",
    "idempotency_key",
    "operation_id",
    "output_language",
    "owner",
    "trigger",
    "window"
  ],
  "x-ratatoskr-provenance": {
    "canonical_source": "ratatoskr_channel_digest_contracts::ChannelDigestRunRequested",
    "contract_id": "channel_digest.run_requested",
    "contract_major_version": 1,
    "generated": "DO NOT EDIT — generated by contractsc from the canonical Rust source. Change the Rust type and run `cargo contracts generate`.",
    "generator": "contractsc",
    "generator_version": "0.1.0",
    "schemars_version": "1.2.2",
    "source_digest": "sha256:18bd0e9ea2ca3fdeb133877177da561bec5a0035f824101f348b7b7c3f4363e6",
    "validation_note": "This schema is a LOWER BOUND on validity. Cross-field invariants and canonical-form rules are enforced by the canonical Rust type; see fixtures/invalid-expectations.toml for which layer rejects what."
  },
  "x-ratatoskr-unknown-policy": "preserve",
  "$defs": {
    "ChannelDigestIdempotencyKey": {
      "title": "ChannelDigestIdempotencyKey",
      "description": "Bounded opaque identity of one logical channel-digest mutation or run request.",
      "type": "string",
      "examples": [
        "digest.018f0000-0000-7000-8000-000000000001"
      ],
      "maxLength": 128,
      "pattern": "^[A-Za-z0-9][A-Za-z0-9._~:@+-]{0,127}$"
    },
    "ChannelDigestRunId": {
      "title": "ChannelDigestRunId",
      "description": "Canonical channel-digest UUID identity.",
      "type": "string",
      "format": "uuid",
      "pattern": "^[0-9a-f]{8}-[0-9a-f]{4}-[0-9a-f]{4}-[0-9a-f]{4}-[0-9a-f]{12}$"
    },
    "ChannelDigestRunTrigger": {
      "description": "Authority which selected one digest run window.",
      "oneOf": [
        {
          "description": "A caller-authenticated on-demand request.",
          "type": "object",
          "properties": {
            "accepted_at": {
              "description": "Platform's accepted instant; must equal the requested window end.",
              "$ref": "#/$defs/WireTimestamp"
            },
            "kind": {
              "type": "string",
              "const": "on_demand"
            }
          },
          "additionalProperties": false,
          "required": [
            "accepted_at",
            "kind"
          ]
        },
        {
          "description": "One stable Platform schedule occurrence.",
          "type": "object",
          "properties": {
            "due_at": {
              "description": "Platform due instant; must equal the requested window end.",
              "$ref": "#/$defs/WireTimestamp"
            },
            "kind": {
              "type": "string",
              "const": "scheduled"
            },
            "occurrence_ref": {
              "description": "Stable occurrence identity for replay-safe scheduling.",
              "$ref": "#/$defs/DigestOccurrenceRef"
            },
            "schedule_ref": {
              "description": "Platform schedule authority.",
              "$ref": "#/$defs/DigestScheduleRef"
            }
          },
          "additionalProperties": false,
          "required": [
            "due_at",
            "kind",
            "occurrence_ref",
            "schedule_ref"
          ]
        }
      ]
    },
    "DigestOccurrenceRef": {
      "title": "DigestOccurrenceRef",
      "description": "Stable Platform occurrence reference for one scheduled digest run.",
      "type": "string",
      "examples": [
        "schedule-occurrence:018f0000-0000-7000-8000-000000000006"
      ],
      "maxLength": 56,
      "pattern": "^schedule-occurrence:[0-9a-f]{8}-[0-9a-f]{4}-[0-9a-f]{4}-[0-9a-f]{4}-[0-9a-f]{12}$"
    },
    "DigestScheduleRef": {
      "title": "DigestScheduleRef",
      "description": "Stable Platform schedule reference for a scheduled digest run.",
      "type": "string",
      "examples": [
        "schedule:018f0000-0000-7000-8000-000000000005"
      ],
      "maxLength": 45,
      "pattern": "^schedule:[0-9a-f]{8}-[0-9a-f]{4}-[0-9a-f]{4}-[0-9a-f]{4}-[0-9a-f]{12}$"
    },
    "DigestWindow": {
      "description": "Closed-open UTC source window for one digest run.",
      "type": "object",
      "properties": {
        "end_at": {
          "description": "Exclusive upper bound.",
          "$ref": "#/$defs/WireTimestamp"
        },
        "start_at": {
          "description": "Inclusive lower bound.",
          "$ref": "#/$defs/WireTimestamp"
        }
      },
      "additionalProperties": false,
      "required": [
        "end_at",
        "start_at"
      ]
    },
    "OperationId": {
      "title": "OperationId",
      "description": "Identity of one long-running operation, stable for its whole lifecycle. Bare canonical lowercase hyphenated UUID; not namespaced.",
      "type": "string",
      "format": "uuid",
      "examples": [
        "018f0000-0000-7000-8000-000000000001"
      ],
      "pattern": "^[0-9a-f]{8}-[0-9a-f]{4}-[0-9a-f]{4}-[0-9a-f]{4}-[0-9a-f]{12}$"
    },
    "OutputLanguage": {
      "description": "Language of the requested first-version recap projection.",
      "oneOf": [
        {
          "description": "Russian recap.",
          "type": "string",
          "const": "ru"
        },
        {
          "description": "English recap.",
          "type": "string",
          "const": "en"
        }
      ]
    },
    "TenantRef": {
      "title": "TenantRef",
      "description": "The owner of the data a record concerns, wire form `user:<uuid>`. The kind set is closed: a consumer that cannot understand the owner kind must reject the record rather than process it.",
      "type": "string",
      "examples": [
        "user:018f0000-0000-7000-8000-000000000005"
      ],
      "maxLength": 41,
      "pattern": "^user:[0-9a-f]{8}-[0-9a-f]{4}-[0-9a-f]{4}-[0-9a-f]{4}-[0-9a-f]{12}$"
    },
    "WireTimestamp": {
      "title": "WireTimestamp",
      "description": "An instant on the wire: RFC 3339 in UTC with the literal `Z` designator. Exactly one spelling is accepted per instant — an input that does not re-render to itself is rejected. The field holding it declares the clock authority.",
      "type": "string",
      "format": "date-time",
      "examples": [
        "2026-08-17T10:00:00Z"
      ],
      "pattern": "^\\d{4}-\\d{2}-\\d{2}T\\d{2}:\\d{2}:\\d{2}(\\.\\d{1,9})?Z$"
    }
  }
}
