{
  "operation_id": "018f0000-0000-7000-8000-000000000101",
  "owner": "user:018f0000-0000-7000-8000-000000000102",
  "digest_run_id": "018f0000-0000-7000-8000-000000000106",
  "idempotency_key": "telegram.digest.018f0000-0000-7000-8000-000000000107",
  "window": {
    "start_at": "2026-08-20T10:00:00Z",
    "end_at": "2026-08-21T10:00:00Z"
  },
  "output_language": "en",
  "trigger": {
    "kind": "on_demand",
    "accepted_at": "2026-08-21T10:00:00Z"
  }
}
